,start_time,end_time,line,value,duration,tracks,laugh_start,laugh_end,start_sec,end_sec
896,"00:45:23,854","00:45:25,089","""Marc, she's still talking.""",0,0.0,,,,2723.85,2725.09
897,"00:45:25,155","00:45:26,023","""I know.",1,1.9400000000000546,"#327, ","2725.21, ","2727.15, ",2725.16,2726.02
898,"00:45:28,092","00:45:30,127","But enough already, right? Let's wrap it up.""",1,1.2300000000000182,"#328, ","2729.61, ","2730.84, ",2728.09,2730.13
899,"00:45:35,332","00:45:37,000",My mother does not love that joke.,1,1.7000000000002728,"#329, ","2737.31, ","2739.01, ",2735.33,2737.0
900,"00:45:37,067","00:45:38,202",[audience laughing],0,0.0,,,,2737.07,2738.2
901,"00:45:42,339","00:45:46,376","You know, some people think that, like, comedy takes courage.",0,0.0,,,,2742.34,2746.38
902,"00:45:46,443","00:45:49,213",I don't know if that's true. I guess it is at some point.,0,0.0,,,,2746.44,2749.21
903,"00:45:49,279","00:45:50,948",I don't even know if what I'm doing is comedy anymore.,0,0.0,,,,2749.28,2750.95
904,"00:45:51,014","00:45:53,183",But I certainly don't have a lot of fear.,0,0.0,,,,2751.01,2753.18
905,"00:45:53,851","00:45:55,419","But I'll tell you what, part of my process--",0,0.0,,,,2753.85,2755.42
906,"00:45:55,486","00:45:57,488",I'll share it with you. I don't write jokes.,0,0.0,,,,2755.49,2757.49
907,"00:45:57,754","00:46:01,892","I write, you know, compulsive thoughts, you know, on Post-its. Now...",1,0.5299999999997453,"#330, ","2763.34, ","2763.87, ",2757.75,2761.89
908,"00:46:03,527","00:46:05,095",these take courage.,0,0.0,,,,2763.53,2765.09
909,"00:46:06,530","00:46:08,899",Because I do these while I'm driving. Now--,1,1.949999999999818,"#331, ","2769.13, ","2771.08, ",2766.53,2768.9
910,"00:46:08,966","00:46:10,234",[audience laughing],0,0.0,,,,2768.97,2770.23
911,"00:46:10,901","00:46:14,438","This is more dangerous than texting, 'cause I need both hands.",0,0.0,,,,2770.9,2774.44
912,"00:46:14,505","00:46:18,041","I gotta hold the pad down on the wheel. Then I gotta write,",1,1.0799999999999272,"#332, ","2776.02, ","2777.1, ",2774.51,2778.04
913,"00:46:18,108","00:46:20,110",and I gotta focus on the important thought.,0,0.0,,,,2778.11,2780.11
914,"00:46:20,811","00:46:24,281","So, my life is put at risk, and the life of others, for these.",0,0.0,,,,2780.81,2784.28
915,"00:46:24,548","00:46:26,850","So, I figure I should share them.",0,0.0,,,,2784.55,2786.85
916,"00:46:26,917","00:46:30,420","Since, you know, many lives were hanging in the balance.",1,4.230000000000018,"#333, ","2789.91, ","2794.14, ",2786.92,2790.42
917,"00:46:30,487","00:46:31,388",[audience cheering],0,0.0,,,,2790.49,2791.39
918,"00:46:31,455","00:46:34,091",Don't-- Don't get too crazy.,0,0.0,,,,2791.45,2794.09
919,"00:46:36,293","00:46:40,430","All right, so, this one just says, um, ""My comfort zone is uncomfortable.""",2,6.639999999999873,"#334, #335, ","2800.79, 2803.15, ","2801.93, 2808.65, ",2796.29,2800.43
920,"00:46:40,497","00:46:42,065",[audience laughing],0,0.0,,,,2800.5,2802.07
921,"00:46:43,233","00:46:45,435","That's worth dying for, right? Right, worth--?",0,0.0,,,,2803.23,2805.43
922,"00:46:45,502","00:46:46,837",[audience cheering],0,0.0,,,,2805.5,2806.84
923,"00:46:49,473","00:46:53,877","This one says, ""I want people to like me, I just want to know why they do.""",2,6.900000000000091,"#336, #337, ","2811.11, 2814.15, ","2811.9, 2820.26, ",2809.47,2813.88
924,"00:46:53,944","00:46:55,379",[audience laughing],0,0.0,,,,2813.94,2815.38
925,"00:46:56,980","00:46:59,383",I think that was worth taking out a pedestrian or two.,0,0.0,,,,2816.98,2819.38
926,"00:47:02,519","00:47:04,121",Here's one. This is interesting.,0,0.0,,,,2822.52,2824.12
927,"00:47:04,188","00:47:07,291","""The monster I created to protect the kid inside me",0,0.0,,,,2824.19,2827.29
928,"00:47:07,357","00:47:08,525","is hard to manage.""",1,3.4099999999998545,"#338, ","2828.83, ","2832.24, ",2827.36,2828.53
929,"00:47:08,592","00:47:09,893",[audience laughing],0,0.0,,,,2828.59,2829.89
930,"00:47:11,461","00:47:13,997","Not funny, but it's a thinker, right? It's a thinker.",1,2.149999999999636,"#339, ","2833.03, ","2835.18, ",2831.46,2834.0
931,"00:47:14,531","00:47:16,867","It makes you think, ""Wow. That should be in a book",0,0.0,,,,2834.53,2836.87
932,"00:47:16,934","00:47:18,268","with other things like that.""",1,2.4200000000000728,"#340, ","2837.34, ","2839.76, ",2836.93,2838.27
933,"00:47:18,335","00:47:19,603",[audience laughing],0,0.0,,,,2838.34,2839.6
934,"00:47:23,907","00:47:25,075","Oh, this one just says:",0,0.0,,,,2843.91,2845.07
935,"00:47:25,142","00:47:27,277","""The trepidation of the Dave Matthews fan.""",2,6.710000000000036,"#341, #342, ","2847.24, 2851.88, ","2849.5, 2856.33, ",2845.14,2847.28
936,"00:47:27,344","00:47:28,512",[audience laughing],0,0.0,,,,2847.34,2848.51
937,"00:47:32,282","00:47:34,885",It's hilarious to me that people respond to just that.,0,0.0,,,,2852.28,2854.89
938,"00:47:36,053","00:47:39,189",'Cause you know who you are. It's not easy for them. It's not easy.,1,1.9399999999995998,"#343, ","2858.8, ","2860.74, ",2856.05,2859.19
939,"00:47:40,624","00:47:43,193","They can't be out with that, you know what I mean?",0,0.0,,,,2860.62,2863.19
940,"00:47:43,393","00:47:45,062",You can't put that into the world.,0,0.0,,,,2863.39,2865.06
941,"00:47:45,128","00:47:46,496",You don't know how that's gonna be received.,0,0.0,,,,2865.13,2866.5
942,"00:47:46,563","00:47:48,065","Not good, generally.",1,0.7199999999997999,"#344, ","2868.88, ","2869.6, ",2866.56,2868.07
943,"00:47:50,100","00:47:53,036",The only place the Dave Matthews fan can truly be comfortable,0,0.0,,,,2870.1,2873.04
944,"00:47:53,103","00:47:55,038","is when they're wearing sandals and cargo shorts,",0,0.0,,,,2873.1,2875.04
945,"00:47:55,105","00:47:56,406",jigging around in an arena...,1,1.9299999999998363,"#345, ","2876.76, ","2878.69, ",2875.11,2876.41
946,"00:47:58,375","00:47:59,876",with other like-minded people.,0,0.0,,,,2878.38,2879.88
947,"00:48:01,245","00:48:03,413","""I hope these mushrooms aren't bunk again.""",1,1.2200000000002547,"#346, ","2883.97, ","2885.19, ",2881.24,2883.41
948,"00:48:03,480","00:48:04,982",[audience laughing],0,0.0,,,,2883.48,2884.98
949,"00:48:07,584","00:48:09,419",I don't need to shit on Dave Matthews.,1,0.8399999999996908,"#347, ","2889.03, ","2889.87, ",2887.58,2889.42
950,"00:48:09,486","00:48:12,155",I don't need to take time to do that. I personally don't like him.,0,0.0,,,,2889.49,2892.16
951,"00:48:12,222","00:48:16,260","But this came from a true, honest, beautiful, human moment.",0,0.0,,,,2892.22,2896.26
952,"00:48:16,326","00:48:17,995",I'll share that with you. But I do need to address,0,0.0,,,,2896.33,2897.99
953,"00:48:18,061","00:48:20,464",the Dave Matthews thing. I listen to a lot of music.,0,0.0,,,,2898.06,2900.46
954,"00:48:21,131","00:48:22,165",I'm very open minded.,0,0.0,,,,2901.13,2902.16
955,"00:48:22,232","00:48:25,535","I can listen to Parliament in the morning, Bert Jansch in the afternoon.",0,0.0,,,,2902.23,2905.53
956,"00:48:25,602","00:48:28,105","And maybe some Gram Parsons. Whatever, I mix it up.",0,0.0,,,,2905.6,2908.11
957,"00:48:28,338","00:48:30,173",I'm not just dropping names to be hip.,1,0.8400000000001455,"#348, ","2909.74, ","2910.58, ",2908.34,2910.17
958,"00:48:30,240","00:48:32,242",I have an open mind when it comes to music.,0,0.0,,,,2910.24,2912.24
959,"00:48:32,309","00:48:34,478",But I cannot get through two of his songs.,0,0.0,,,,2912.31,2914.48
960,"00:48:34,544","00:48:36,179",I can't get through. I--,1,1.8400000000001455,"#349, ","2914.7, ","2916.54, ",2914.54,2916.18
961,"00:48:36,647","00:48:38,015",And I try. I try.,0,0.0,,,,2916.65,2918.01
962,"00:48:38,081","00:48:40,550","By midway-- By midway through the second song,",0,0.0,,,,2918.08,2920.55
963,"00:48:40,917","00:48:43,587",I get a type of boredom that's not even normal boredom.,0,0.0,,,,2920.92,2923.59
964,"00:48:43,654","00:48:46,023",It's like there's an edge to it.,1,0.5900000000001455,"#350, ","2924.08, ","2924.67, ",2923.65,2926.02
965,"00:48:46,089","00:48:47,591",It's like an aggravated boredom.,0,0.0,,,,2926.09,2927.59
966,"00:48:47,658","00:48:50,994","Like the boredom sets in, and then I'm like, ""God, fuck. What the--",2,2.2400000000002365,"#351, #352, ","2929.18, 2930.85, ","2929.94, 2932.33, ",2927.66,2930.99
967,"00:48:51,061","00:48:52,095","Why? Why?""",0,0.0,,,,2931.06,2932.09
968,"00:48:52,362","00:48:54,398","Like, I don't know what that is.",1,1.0600000000004002,"#353, ","2936.7, ","2937.76, ",2932.36,2934.4
969,"00:48:54,464","00:48:55,399",[audience laughing],0,0.0,,,,2934.46,2935.4
970,"00:48:57,634","00:49:00,304","But I know people like him. And, you know, good for you.",0,0.0,,,,2937.63,2940.3
971,"00:49:00,370","00:49:01,672",I know it's hard for you guys.,1,1.2199999999998,"#354, ","2941.96, ","2943.18, ",2940.37,2941.67
972,"00:49:05,108","00:49:06,410",It's very hard to defend that.,1,0.7100000000000364,"#355, ","2945.85, ","2946.56, ",2945.11,2946.41
973,"00:49:08,412","00:49:11,281","And the moment that I had, which was kind of beautiful, was...",0,0.0,,,,2948.41,2951.28
974,"00:49:12,416","00:49:16,019",It was great. I was in Iowa City doing a gig.,0,0.0,,,,2952.42,2956.02
975,"00:49:16,086","00:49:17,187",[audience members whooping],0,0.0,,,,2956.09,2957.19
976,"00:49:17,254","00:49:19,189","Oh, yeah? It's a very interesting town.",1,0.8299999999999272,"#356, ","2957.36, ","2958.19, ",2957.25,2959.19
977,"00:49:19,256","00:49:23,193","I've never seen a town more separated into, like, full on sports meatheads,",0,0.0,,,,2959.26,2963.19
978,"00:49:23,360","00:49:25,729","and then the writers' program, you know? So, like...",1,0.650000000000091,"#357, ","2966.08, ","2966.73, ",2963.36,2965.73
979,"00:49:25,996","00:49:27,230",[audience laughing],0,0.0,,,,2966.0,2967.23
980,"00:49:27,698","00:49:30,434","There's just people that are just like, ""We're gonna win!""",1,2.4699999999998,"#358, ","2968.07, ","2970.54, ",2967.7,2970.43
981,"00:49:30,500","00:49:33,470","And then people like, ""I'm still sad about David Foster Wallace.",0,0.0,,,,2970.5,2973.47
982,"00:49:33,537","00:49:35,672","I'm never gonna get over--"" And somehow,",1,2.6900000000000546,"#359, ","2973.98, ","2976.67, ",2973.54,2975.67
983,"00:49:35,739","00:49:38,608",there's a perfect yin yang to the thing. This complete--,0,0.0,,,,2975.74,2978.61
984,"00:49:41,411","00:49:43,714","Okay, so, I'm getting coffee in Iowa City.",0,0.0,,,,2981.41,2983.71
985,"00:49:43,980","00:49:45,716",There's a guy getting coffee in front of me. He's ordering.,0,0.0,,,,2983.98,2985.72
986,"00:49:45,982","00:49:47,117",There's a barista there.,0,0.0,,,,2985.98,2987.12
987,"00:49:47,184","00:49:50,053",And the guy ordering coffee says to the guy making coffee:,0,0.0,,,,2987.18,2990.05
988,"00:49:50,120","00:49:52,255","""What are you doing this weekend?"" The guy making coffee looks up,",0,0.0,,,,2990.12,2992.26
989,"00:49:52,322","00:49:54,624","and he's like, ""Oh, I'm going to a concert.""",0,0.0,,,,2992.32,2994.62
990,"00:49:55,392","00:49:58,562","Then the guy ordering coffee goes, ""Really? Who are you going to see?""",0,0.0,,,,2995.39,2998.56
991,"00:49:58,628","00:50:01,598","And then the other guy stood up, and I saw it in his face.",1,4.419999999999618,"#360, ","3001.76, ","3006.18, ",2998.63,3001.6
992,"00:50:02,299","00:50:03,633",[audience laughing],0,0.0,,,,3002.3,3003.63
993,"00:50:07,471","00:50:09,106","""Dave Matthews Band.""",1,2.2600000000002183,"#361, ","3008.29, ","3010.55, ",3007.47,3009.11
994,"00:50:11,475","00:50:15,312",And I was-- I felt for him. It was courageous.,1,1.1100000000001273,"#362, ","3016.08, ","3017.19, ",3011.47,3015.31
995,"00:50:16,446","00:50:18,382",He put himself out there. That's hard.,0,0.0,,,,3016.45,3018.38
996,"00:50:18,448","00:50:20,484","You know, you don't know how it's gonna land.",1,0.9200000000000728,"#363, ","3020.15, ","3021.07, ",3018.45,3020.48
997,"00:50:20,684","00:50:24,388","It hung there for, like, two, like, really tense seconds.",1,1.2400000000002365,"#364, ","3024.85, ","3026.09, ",3020.68,3024.39
998,"00:50:25,589","00:50:28,692","And then the other guy goes, ""Oh, I fucking love Dave Matthews.""",1,2.2600000000002183,"#365, ","3027.87, ","3030.13, ",3025.59,3028.69
999,"00:50:29,726","00:50:32,329","And I was so happy for them, that they had this moment.",1,2.5799999999999272,"#366, ","3030.9, ","3033.48, ",3029.73,3032.33
1000,"00:50:33,330","00:50:35,665",I knew in my heart they were both wrong. I knew that.,1,4.950000000000273,"#367, ","3035.24, ","3040.19, ",3033.33,3035.66
1001,"00:50:35,732","00:50:37,167",[audience laughing],0,0.0,,,,3035.73,3037.17
1002,"00:50:37,234","00:50:38,368",But I was happy for them.,0,0.0,,,,3037.23,3038.37
1003,"00:50:39,302","00:50:41,471","'Cause I'm a big-hearted, tolerant person.",1,6.570000000000164,"#368, ","3041.16, ","3047.73, ",3039.3,3041.47
1004,"00:50:41,538","00:50:42,806",[audience applauding],0,0.0,,,,3041.54,3042.81
1005,"00:50:48,111","00:50:49,746","Oh, yeah. This one. This one just says:",0,0.0,,,,3048.11,3049.75
1006,"00:50:49,813","00:50:53,283","""I expect relief and life-changing impact from everything.""",0,0.0,,,,3049.81,3053.28
1007,"00:50:53,683","00:50:55,185",[audience laughing],0,0.0,,,,3053.68,3055.18
1008,"00:50:56,586","00:50:57,454",That's a lot.,0,0.0,,,,3056.59,3057.45
1009,"00:50:58,622","00:51:01,391","Then there's a second thought, because there's a line here.",0,0.0,,,,3058.62,3061.39
1010,"00:51:01,458","00:51:03,760","So, I must have stopped driving and just sort of like:",0,0.0,,,,3061.46,3063.76
1011,"00:51:05,629","00:51:09,599","The other one says, ""The space between despair and orgasm is hard to fill.""",2,2.4400000000000546,"#369, #370, ","3070.22, 3072.24, ","3071.47, 3073.43, ",3065.63,3069.6
1012,"00:51:10,133","00:51:11,501",[audience laughing],0,0.0,,,,3070.13,3071.5
1013,"00:51:12,736","00:51:15,705","And that's not a time thing, that's a philosophical idea.",1,1.9099999999998545,"#371, ","3074.63, ","3076.54, ",3072.74,3075.7
1014,"00:51:22,245","00:51:23,113",So...,0,0.0,,,,3082.24,3083.11
1015,"00:51:27,350","00:51:28,218",Some guy...,0,0.0,,,,3087.35,3088.22
1016,"00:51:30,487","00:51:31,588",Some guy sent me a hat.,2,1.849999999999909,"#372, #373, ","3090.94, 3095.81, ","3091.65, 3096.95, ",3090.49,3091.59
1017,"00:51:38,862","00:51:42,866","He sent me a hat. Look, I don't know how hat companies stay in business, you know?",1,0.6200000000003456,"#374, ","3103.74, ","3104.36, ",3098.86,3102.87
1018,"00:51:44,668","00:51:46,403","It was a gift, I guess, you know.",0,0.0,,,,3104.67,3106.4
1019,"00:51:46,470","00:51:49,473","And I know, I'm a guy. I've been the guy on the street,",0,0.0,,,,3106.47,3109.47
1020,"00:51:49,539","00:51:51,808","just standing there. You see a hipster with a hat,",0,0.0,,,,3109.54,3111.81
1021,"00:51:51,875","00:51:53,677","and you're like, ""Oh, I gotta get a fucking hat.""",0,0.0,,,,3111.88,3113.68
1022,"00:51:53,743","00:51:54,711",I've been that guy.,1,1.2599999999997635,"#375, ","3113.94, ","3115.2, ",3113.74,3114.71
1023,"00:51:56,379","00:51:57,581",But I don't know how they stay in business.,0,0.0,,,,3116.38,3117.58
1024,"00:51:57,647","00:51:59,416","Anyways, this guy sent me a hat.",0,0.0,,,,3117.65,3119.42
1025,"00:51:59,483","00:52:02,252",It was a big hat. It was a fancy hat. It was a Stetson hat.,0,0.0,,,,3119.48,3122.25
1026,"00:52:02,319","00:52:05,655",I didn't know the guy well. But it was a gift. It wasn't a cowboy hat.,1,0.650000000000091,"#376, ","3124.72, ","3125.37, ",3122.32,3125.66
1027,"00:52:06,256","00:52:09,493",It was like a-- Like a 1800s derby looking hat.,0,0.0,,,,3126.26,3129.49
1028,"00:52:09,559","00:52:10,427",Nice hat.,0,0.0,,,,3129.56,3130.43
1029,"00:52:10,694","00:52:12,863",But I would've had to change my entire life...,3,7.050000000000182,"#377, #378, #379, ","3130.9, 3133.57, 3139.27, ","3131.88, 3135.8, 3143.11, ",3130.69,3132.86
1030,"00:52:13,129","00:52:14,331",[audience laughing],0,0.0,,,,3133.13,3134.33
1031,"00:52:20,837","00:52:22,906","you know, to accommodate that hat. I just--",0,0.0,,,,3140.84,3142.91
1032,"00:52:25,475","00:52:27,410",I knew two things when I opened that box.,0,0.0,,,,3145.47,3147.41
1033,"00:52:27,477","00:52:30,180","I'm like, ""That is a nice hat."" I Googled it. It's a $100 hat.",1,0.9299999999998363,"#380, ","3148.9, ","3149.83, ",3147.48,3150.18
1034,"00:52:30,247","00:52:33,283",And it's never leaving the house on my head. It's never going out.,1,0.8899999999998727,"#381, ","3152.6, ","3153.49, ",3150.25,3153.28
1035,"00:52:33,817","00:52:35,318",Not gonna happen for that hat.,0,0.0,,,,3153.82,3155.32
1036,"00:52:35,852","00:52:38,488","Because-- All right, I'll be honest with you.",0,0.0,,,,3155.85,3158.49
1037,"00:52:38,555","00:52:39,923","Yeah, I'll tell you. All right.",0,0.0,,,,3158.55,3159.92
1038,"00:52:41,391","00:52:43,393",I've been the guy...,1,0.7599999999997635,"#382, ","3162.15, ","3162.91, ",3161.39,3163.39
1039,"00:52:44,394","00:52:47,230",in a store that sells big stupid hats.,0,0.0,,,,3164.39,3167.23
1040,"00:52:48,665","00:52:51,501","Standing in front of a mirror with a big stupid hat on,",1,1.8099999999999454,"#383, ","3171.79, ","3173.6, ",3168.66,3171.5
1041,"00:52:52,369","00:52:54,304","saying, ""Oh, hell yeah.",1,1.9699999999998,"#384, ","3174.65, ","3176.62, ",3172.37,3174.3
1042,"00:52:54,838","00:52:56,172",This is my hat.,0,0.0,,,,3174.84,3176.17
1043,"00:52:56,773","00:52:58,441","I fucking love this hat.""",0,0.0,,,,3176.77,3178.44
1044,"00:52:58,508","00:53:02,245",It's good and important that you have someone you love there at that moment...,0,0.0,,,,3178.51,3182.24
1045,"00:53:03,647","00:53:06,449","to helpfully say, ""Don't buy a hat.""",2,2.4200000000005275,"#385, #386, ","3183.66, 3186.95, ","3184.5, 3188.53, ",3183.65,3186.45
1046,"00:53:08,718","00:53:10,220","It's not gonna stop you, though. 'Cause you're gonna be like:",1,0.6599999999998545,"#387, ","3189.79, ","3190.45, ",3188.72,3190.22
1047,"00:53:10,287","00:53:12,222","""Oh, no, baby. This is my hat.",0,0.0,,,,3190.29,3192.22
1048,"00:53:12,289","00:53:14,524","Come on, are you crazy? Look at this fucking hat.""",1,1.7100000000000364,"#388, ","3193.33, ","3195.04, ",3192.29,3194.52
1049,"00:53:14,758","00:53:17,894","And then she'll say, ""All right. Do what you want. Do what you want.""",0,0.0,,,,3194.76,3197.89
1050,"00:53:19,329","00:53:21,231",And you buy that hat. You buy that hat.,0,0.0,,,,3199.33,3201.23
1051,"00:53:21,298","00:53:23,533",And the confidence you had in front of that mirror,0,0.0,,,,3201.3,3203.53
1052,"00:53:24,200","00:53:25,635",doesn't even last four blocks...,0,0.0,,,,3204.2,3205.64
1053,"00:53:25,969","00:53:27,470",[audience laughing],0,0.0,,,,3205.97,3207.47
1054,"00:53:27,971","00:53:29,706",out of the store. You walk out like:,0,0.0,,,,3207.97,3209.71
1055,"00:53:29,773","00:53:30,907","""Why's everyone looking at my hat? Is it too big?",0,0.0,,,,3209.77,3210.91
1056,"00:53:30,974","00:53:33,877",Am I not a big enough man to wear this hat? Did I just fuck up?,0,0.0,,,,3210.97,3213.88
1057,"00:53:33,944","00:53:36,379",Was she right? Is this a shitty hat? Am I a shitty person?,0,0.0,,,,3213.94,3216.38
1058,"00:53:36,446","00:53:37,514","Why'd I buy this hat?""",0,0.0,,,,3216.45,3217.51
1059,"00:53:40,250","00:53:42,919",But now you're in. You've bought the hat and you've gotta go home.,0,0.0,,,,3220.25,3222.92
1060,"00:53:43,587","00:53:45,555",You're gonna have to make some decisions...,0,0.0,,,,3223.59,3225.55
1061,"00:53:46,756","00:53:47,657",around that hat.,1,0.5,"#389, ","3227.17, ","3227.67, ",3226.76,3227.66
1062,"00:53:48,425","00:53:50,694","Usually the first one is something along the lines of, like:",0,0.0,,,,3228.43,3230.69
1063,"00:53:51,361","00:53:54,230","""Hey, you know, I think I'm just gonna make this a house hat.",2,1.7599999999997635,"#390, #391, ","3232.23, 3234.52, ","3232.85, 3235.66, ",3231.36,3234.23
1064,"00:53:54,297","00:53:55,665",[audience laughing],0,0.0,,,,3234.3,3235.66
1065,"00:53:56,299","00:53:59,769","I'm just gonna wear it around the house. Maybe outside, if I go outside.",0,0.0,,,,3236.3,3239.77
1066,"00:54:00,437","00:54:02,973","But you know, baby, it's too nice. I don't wanna lose it.",0,0.0,,,,3240.44,3242.97
1067,"00:54:03,740","00:54:04,908","Or, you know, scuff it up.",0,0.0,,,,3243.74,3244.91
1068,"00:54:04,975","00:54:07,744","I'm just gonna wear it around the house."" And she's like: ""Uh-huh.""",1,1.599999999999909,"#392, ","3248.29, ","3249.89, ",3244.97,3247.74
1069,"00:54:09,279","00:54:11,247","""That's what I'm gonna do with the hat.""",0,0.0,,,,3249.28,3251.25
1070,"00:54:11,314","00:54:13,483",And you do it. You eat breakfast in the hat.,0,0.0,,,,3251.31,3253.48
1071,"00:54:15,352","00:54:18,421","You sit on the couch, listen to records, wearing your big dumb hat.",1,0.849999999999909,"#393, ","3258.56, ","3259.41, ",3255.35,3258.42
1072,"00:54:19,623","00:54:21,758",Maybe you put it on naked to get her to like it.,0,0.0,,,,3259.62,3261.76
1073,"00:54:21,825","00:54:22,859","Like, ""What about now?""",1,2.6600000000003092,"#394, ","3264.14, ","3266.8, ",3261.82,3262.86
1074,"00:54:26,563","00:54:30,333","And she's like, ""No, no. Take it off. It's stupid. Dumb decision.""",1,0.9099999999998545,"#395, ","3268.75, ","3269.66, ",3266.56,3270.33
1075,"00:54:31,735","00:54:33,670","Eventually, it starts working your brain.",0,0.0,,,,3271.74,3273.67
1076,"00:54:33,737","00:54:35,472","You're like, ""Why'd I get this hat?""",0,0.0,,,,3273.74,3275.47
1077,"00:54:36,506","00:54:38,274",That's the day it becomes a wall hat.,0,0.0,,,,3276.51,3278.27
1078,"00:54:38,341","00:54:40,477","You're like, ""I don't wanna throw it out. It's so nice.",0,0.0,,,,3278.34,3280.48
1079,"00:54:40,543","00:54:42,312","I'm gonna hang it up like a picture.""",1,0.9299999999998363,"#396, ","3281.8, ","3282.73, ",3280.54,3282.31
1080,"00:54:42,412","00:54:45,682","And you put a nail in the wall, and you hang up your stupid nice hat.",0,0.0,,,,3282.41,3285.68
1081,"00:54:46,650","00:54:48,351",With the other artwork on the wall.,0,0.0,,,,3286.65,3288.35
1082,"00:54:49,819","00:54:50,687",It's a wall hat.,0,0.0,,,,3289.82,3290.69
1083,"00:54:52,489","00:54:54,324","People come over, they're like, ""That's a nice hat. You wear that?""",0,0.0,,,,3292.49,3294.32
1084,"00:54:54,391","00:54:55,692","""Not anymore. It's too nice.",0,0.0,,,,3294.39,3295.69
1085,"00:54:56,059","00:54:58,728","Could you not touch it, please? Please, don't put it on.",0,0.0,,,,3296.06,3298.73
1086,"00:54:58,795","00:55:01,297","Just leave it by the-- Just put it back. Thank you.""",0,0.0,,,,3298.8,3301.3
1087,"00:55:03,299","00:55:05,669","It stays up on the wall, until one day you realize--",0,0.0,,,,3303.3,3305.67
1088,"00:55:05,735","00:55:07,671",Maybe in the middle of a bowl of cereal--,0,0.0,,,,3305.74,3307.67
1089,"00:55:07,971","00:55:10,573","You're like, ""Why is that up there? That was a mistake.",0,0.0,,,,3307.97,3310.57
1090,"00:55:11,041","00:55:13,843",That was a shitty decision. That's a little shame gallery.,0,0.0,,,,3311.04,3313.84
1091,"00:55:13,910","00:55:17,681",Why do I have to be reminded that I bought that dumb fucking hat,1,0.5199999999999818,"#397, ","3315.9, ","3316.42, ",3313.91,3317.68
1092,"00:55:17,747","00:55:19,649",every day when I sit at this table?,1,0.5100000000002183,"#398, ","3318.74, ","3319.25, ",3317.75,3319.65
1093,"00:55:19,916","00:55:20,784","Fuck that hat.""",1,1.2000000000002728,"#399, ","3320.99, ","3322.19, ",3319.92,3320.78
1094,"00:55:23,353","00:55:27,757",That's the day it becomes a closet hat. That's officially closet hat day.,1,2.200000000000273,"#400, ","3325.41, ","3327.61, ",3323.35,3327.76
1095,"00:55:29,492","00:55:31,895","And it can stay in there for a long time. Years, even.",0,0.0,,,,3329.49,3331.89
1096,"00:55:32,328","00:55:34,097","And then one day, you're cleaning out that closet,",0,0.0,,,,3332.33,3334.1
1097,"00:55:34,364","00:55:35,999",all the hate for the hat comes back.,1,1.4900000000002365,"#401, ","3335.37, ","3336.86, ",3334.36,3336.0
1098,"00:55:36,466","00:55:38,768","You're like, ""Aw, fuck this hat. Goddamn it.",0,0.0,,,,3336.47,3338.77
1099,"00:55:39,903","00:55:41,371","I thought I got rid of this.""",0,0.0,,,,3339.9,3341.37
1100,"00:55:41,538","00:55:43,840",And that's the day it becomes a Goodwill hat.,0,0.0,,,,3341.54,3343.84
1101,"00:55:45,642","00:55:48,411","And three days after it becomes a Goodwill hat,",0,0.0,,,,3345.64,3348.41
1102,"00:55:48,478","00:55:50,346",a hipster guy walks into Goodwill.,0,0.0,,,,3348.48,3350.35
1103,"00:55:51,614","00:55:53,817","And he sees the hat, he's like, ""Holy shit.",0,0.0,,,,3351.61,3353.82
1104,"00:55:54,017","00:55:56,119",That's a nice hat. That's a $100.00 hat.,0,0.0,,,,3354.02,3356.12
1105,"00:55:56,886","00:55:58,922","Six bucks? Hell yeah.""",0,0.0,,,,3356.89,3358.92
1106,"00:55:59,122","00:56:00,724","And he puts it on his head,",0,0.0,,,,3359.12,3360.72
1107,"00:56:00,790","00:56:03,393",and it looks like they've been together for centuries.,0,0.0,,,,3360.79,3363.39
1108,"00:56:03,460","00:56:06,529","Perfect symbiosis, on a soul level.",0,0.0,,,,3363.46,3366.53
1109,"00:56:06,596","00:56:07,997",Everything makes sense.,0,0.0,,,,3366.6,3368.0
1110,"00:56:08,631","00:56:11,468",Two things have been brought together to make a whole.,0,0.0,,,,3368.63,3371.47
1111,"00:56:12,702","00:56:15,004","And he buys that hat, and he leaves a happy man.",0,0.0,,,,3372.7,3375.0
1112,"00:56:15,705","00:56:18,408","And then somewhere along his route, there's an old guy across the street",0,0.0,,,,3375.7,3378.41
1113,"00:56:18,475","00:56:20,944","looking at him going, ""I gotta get a fucking hat.""",1,11.920000000000073,"#402, ","3381.39, ","3393.31, ",3378.47,3380.94
