,start_time,end_time,line,value,duration,tracks,laugh_start,laugh_end,start_sec,end_sec
0,"00:00:14,222","00:00:17,475","Sometimes, the funniest thing to say is mean.",0,0.0,,,,14.22,17.48
1,"00:00:18,143","00:00:19,352",You know what I mean?,0,0.0,,,,18.14,19.35
2,"00:00:19,644","00:00:21,688",It's a tough position to be in.,0,0.0,,,,19.64,21.69
3,"00:00:22,230","00:00:24,107","So I say a lot of mean things,",0,0.0,,,,22.23,24.11
4,"00:00:24,190","00:00:25,900",but you guys got to remember.,0,0.0,,,,24.19,25.9
5,"00:00:25,984","00:00:27,736",I'm not saying it to be mean.,0,0.0,,,,25.98,27.74
6,"00:00:27,986","00:00:29,571",I'm saying it because it's funny.,1,1.1499999999999986,"#0, ","29.8, ","30.95, ",27.99,29.57
7,"00:00:31,281","00:00:34,367",And everything's funny till it happens to you.,2,8.380000000000003,"#1, #2, ","35.11, 37.25, ","36.9, 43.84, ",31.28,34.37
8,"00:00:38,913","00:00:39,998",<i>♪ Revelation ♪</i>,0,0.0,,,,38.91,40.0
9,"00:00:41,041","00:00:44,753",<i> Don't stop. Keep on...</i> <i><i> ♪ Sunshine ♪</i></i>,0,0.0,,,,41.04,44.75
10,"00:00:48,256","00:00:49,215",<i>♪ Ecstatic ♪</i>,0,0.0,,,,48.26,49.22
11,"00:00:52,302","00:00:53,303",<i>♪ Flaco ♪</i>,0,0.0,,,,52.3,53.3
12,"00:00:53,386","00:00:54,220",<i>♪ Boogieman ♪</i>,0,0.0,,,,53.39,54.22
13,"00:00:54,304","00:00:56,473",<i>♪ I'm standing in the sun</i> <i>Getting black as I want ♪</i>,0,0.0,,,,54.3,56.47
14,"00:00:56,556","00:00:59,017",<i>♪ You playing good D</i> <i>And that ain't backing me up ♪</i>,0,0.0,,,,56.56,59.02
15,"00:00:59,100","00:01:01,269",<i>♪ Sky woke a baby</i> <i>Ain't no jackin' my hem ♪</i>,0,0.0,,,,59.1,61.27
16,"00:01:01,352","00:01:04,439",<i>♪ I got a whole lot to say</i> <i>So I ain't talking to them ♪</i>,1,0.8899999999999935,"#3, ","63.74, ","64.63, ",61.35,64.44
17,"00:01:04,522","00:01:07,025",<i>♪ I hear knees dropping</i> <i>I turn it up louder ♪</i>,1,6.359999999999999,"#4, ","65.84, ","72.2, ",64.52,67.03
18,"00:01:07,567","00:01:09,736","<i>♪ Black freedom, black genius</i> <i>Black power ♪</i>",0,0.0,,,,67.57,69.74
19,"00:01:10,278","00:01:12,197",<i>♪ Black ink</i> <i>For printing the black dollar ♪</i>,0,0.0,,,,70.28,72.2
20,"00:01:12,280","00:01:13,865",<i>♪ Until I CIA ♪</i>,0,0.0,,,,72.28,73.86
21,"00:01:13,948","00:01:15,116","<i>♪ I say, ""Now what?"" ♪</i>",1,0.8299999999999983,"#5, ","74.24, ","75.07, ",73.95,75.12
22,"00:01:16,910","00:01:17,744",Phew.,0,0.0,,,,76.91,77.74
23,"00:01:17,827","00:01:19,746","Well, it's the last show.",0,0.0,,,,77.83,79.75
24,"00:01:20,538","00:01:21,498",Here we are.,0,0.0,,,,80.54,81.5
25,"00:01:22,123","00:01:23,333",Los Angeles.,0,0.0,,,,82.12,83.33
26,"00:01:24,667","00:01:25,960",The world capital of...,0,0.0,,,,84.67,85.96
27,"00:01:26,711","00:01:28,088",rape and dick breath.,1,2.8499999999999943,"#6, ","88.01, ","90.86, ",86.71,88.09
28,"00:01:32,050","00:01:33,885",The fuck has been going on out here?,2,2.1199999999999903,"#7, #8, ","93.51, 95.78, ","94.41, 97.0, ",92.05,93.89
29,"00:01:38,264","00:01:39,182",Keeps getting worse.,0,0.0,,,,98.26,99.18
30,"00:01:39,265","00:01:42,185","Just when you think it can't get worse, they got Charlie Rose today.",1,1.9500000000000028,"#9, ","104.1, ","106.05, ",99.27,102.19
31,"00:01:47,232","00:01:49,943",It's going to be a quiet morning on the news tomorrow.,2,4.11999999999999,"#10, #11, ","109.37, 111.48, ","111.24, 113.73, ",107.23,109.94
32,"00:01:54,072","00:01:56,407",Charlie Rose. Who's next? Captain Kangaroo?,1,1.0900000000000034,"#12, ","116.45, ","117.54, ",114.07,116.41
33,"00:01:57,408","00:02:01,830",Everybody is raping like hotcakes.,1,1.269999999999996,"#13, ","121.79, ","123.06, ",117.41,121.83
34,"00:02:03,414","00:02:05,375","I, for one, am starting to get worried.",1,0.6700000000000017,"#14, ","125.69, ","126.36, ",123.41,125.38
35,"00:02:06,960","00:02:09,045","You know, I've been in show business 30 years.",0,0.0,,,,126.96,129.04
36,"00:02:09,546","00:02:11,506",I had no idea how much danger I was in.,1,3.6599999999999966,"#15, ","131.35, ","135.01, ",129.55,131.51
37,"00:02:16,010","00:02:17,595",It's really some scary shit.,0,0.0,,,,136.01,137.59
38,"00:02:19,472","00:02:20,390",I gotta tell you.,0,0.0,,,,139.47,140.39
39,"00:02:21,474","00:02:24,310",Harvey Weinstein's probably the first person that I ever,0,0.0,,,,141.47,144.31
40,"00:02:24,769","00:02:26,729","looked at a photograph of and was like,",0,0.0,,,,144.77,146.73
41,"00:02:27,063","00:02:28,106","""Yeah, he rapes.""",1,1.289999999999992,"#16, ","148.12, ","149.41, ",147.06,148.11
42,"00:02:32,735","00:02:35,155",I'm not sure this motherfucker has a choice.,0,0.0,,,,152.74,155.16
43,"00:02:37,949","00:02:39,450",Not a handsome man.,1,0.8199999999999932,"#17, ","159.22, ","160.04, ",157.95,159.45
44,"00:02:39,909","00:02:42,412",A lot of meat and extra skin on his face.,0,0.0,,,,159.91,162.41
45,"00:02:46,791","00:02:48,793","Yeah, he's ugly. You know, the sad part is",0,0.0,,,,166.79,168.79
46,"00:02:48,877","00:02:52,297","he's done so well in life, he probably doesn't know he's ugly.",0,0.0,,,,168.88,172.3
47,"00:02:53,673","00:02:56,217","You know, when you're good-looking, everybody will tell you.",0,0.0,,,,173.67,176.22
48,"00:02:56,301","00:02:58,553","""Oh, you look wonderful, you're so great looking.""",0,0.0,,,,176.3,178.55
49,"00:02:58,970","00:03:00,180",But when you're ugly.,0,0.0,,,,178.97,180.18
50,"00:03:01,514","00:03:03,683",You gotta figure that shit out for yourself.,1,1.7299999999999898,"#18, ","183.4, ","185.13, ",181.51,183.68
51,"00:03:05,310","00:03:08,146","It's a lot of putting clues together, really is.",0,0.0,,,,185.31,188.15
52,"00:03:08,479","00:03:11,941","""Why am I not getting in the club? I got all the right shit on.""",1,2.6200000000000045,"#19, ","191.5, ","194.12, ",188.48,191.94
53,"00:03:20,575","00:03:23,369","If it was Brad Pitt doing that shit, you wouldn't have heard a peep.",0,0.0,,,,200.57,203.37
54,"00:03:24,829","00:03:27,207","Girl would've just come back down like, ""I got the part.""",2,5.009999999999991,"#20, #21, ","206.77, 211.04, ","210.26, 212.56, ",204.83,207.21
55,"00:03:33,129","00:03:34,005",Yuck!,0,0.0,,,,213.13,214.0
56,"00:03:34,088","00:03:35,006",Good one.,1,0.8899999999999864,"#22, ","215.27, ","216.16, ",214.09,215.01
57,"00:03:37,258","00:03:40,762","Yet, and yet, it is important that I acknowledge ladies.",0,0.0,,,,217.26,220.76
58,"00:03:41,262","00:03:44,015",You are absolutely right.,0,0.0,,,,221.26,224.01
59,"00:03:44,641","00:03:45,558",There you go.,0,0.0,,,,224.64,225.56
60,"00:03:48,144","00:03:51,564","And we gotta all be mindful of that, guys, because...",0,0.0,,,,228.14,231.56
61,"00:03:52,273","00:03:55,235",this could have happened to any of us. It could of happened to me.,0,0.0,,,,232.27,235.24
62,"00:03:55,526","00:03:56,444",I can see that.,0,0.0,,,,235.53,236.44
63,"00:03:57,320","00:04:01,574","I see myself showing up, ""Hi, I'm here for my three a.m. with Mr. Weinstein.""",3,5.310000000000002,"#23, #24, #25, ","241.6, 244.59, 247.49, ","243.38, 246.87, 248.74, ",237.32,241.57
64,"00:04:07,956","00:04:10,541","""Hey, Harvey, I got your text. I'm here to talk about the script.""",1,2.3100000000000023,"#26, ","250.47, ","252.78, ",247.96,250.54
65,"00:04:13,044","00:04:16,881","""Seems like it's going to be hard to read in candlelight, but I guess I could try.""",2,2.049999999999983,"#27, #28, ","255.59, 260.83, ","257.08, 261.39, ",253.04,256.88
66,"00:04:22,887","00:04:25,682",Sound like a fucking nightmare. Could you imagine that shit? Could you imagine you was in a business meeting and a motherfucker,0,0.0,,,,262.89,265.68
67,"00:04:30,103","00:04:31,479",pulled their dick out?,1,2.1300000000000523,"#29, ","271.59, ","273.72, ",270.1,271.48
68,"00:04:33,606","00:04:35,566","In the middle of the meeting? I'd be like, ""Yo!",1,0.9399999999999977,"#30, ","275.29, ","276.23, ",273.61,275.57
69,"00:04:36,317","00:04:39,904","Yo, my man, that is the most unprofessional shit I've ever seen.",1,1.5,"#31, ","279.03, ","280.53, ",276.32,279.9
70,"00:04:39,988","00:04:41,489","In all my days.""",1,2.6499999999999773,"#32, ","281.86, ","284.51, ",279.99,281.49
71,"00:04:45,285","00:04:47,287","""Just let me finish, Dave Chappelle.""",1,1.5199999999999818,"#33, ","287.42, ","288.94, ",285.29,287.29
72,"00:04:48,663","00:04:51,624","""I'll put you in all three <i>Lord of the Rings.</i>""",1,1.5600000000000023,"#34, ","295.16, ","296.72, ",288.66,291.62
73,"00:04:58,673","00:05:00,800","""Hurry up, nigga. I have other meetings, you know.""",1,2.9399999999999977,"#35, ","300.05, ","302.99, ",298.67,300.8
74,"00:05:02,844","00:05:05,596","""I have a 4:30 a.m. at Brett Ratner's house, and uh...""",1,3.2600000000000477,"#36, ","304.71, ","307.97, ",302.84,305.6
75,"00:05:08,558","00:05:10,476","""I believe it's a wardrobe fitting.""",3,4.600000000000023,"#37, #38, #39, ","310.44, 312.88, 315.42, ","312.17, 313.99, 317.18, ",308.56,310.48
76,"00:05:19,277","00:05:20,153",Wow.,0,0.0,,,,319.28,320.15
77,"00:05:21,279","00:05:24,991","I mean, it is really bad out here, isn't it?",0,0.0,,,,321.28,324.99
78,"00:05:25,700","00:05:28,703","Kevin Spacey is out here, grabbing men by the pussy.",2,1.8800000000000523,"#40, #41, ","328.65, 330.77, ","330.0, 331.3, ",325.7,328.7
79,"00:05:31,039","00:05:32,915",I didn't even know that was possible.,0,0.0,,,,331.04,332.92
80,"00:05:33,916","00:05:35,251",Jesus Christ.,1,1.740000000000009,"#42, ","336.34, ","338.08, ",333.92,335.25
81,"00:05:40,381","00:05:43,051",He got the guy from <i>Star Trek: The Next Generation.</i>,0,0.0,,,,340.38,343.05
82,"00:05:43,134","00:05:45,261",That's who he-- that's who he got.,0,0.0,,,,343.13,345.26
83,"00:05:45,345","00:05:48,348","The last time. It sounded like he was more than that, but...",0,0.0,,,,345.35,348.35
84,"00:05:48,890","00:05:51,559",that's who-- that's who set it off.,0,0.0,,,,348.89,351.56
85,"00:05:52,101","00:05:55,688","He was 14-years-old. And Kevin Spacey accosted him at a party,",0,0.0,,,,352.1,355.69
86,"00:05:55,772","00:05:58,358","which I gotta say, by the way, just for the record,",0,0.0,,,,355.77,358.36
87,"00:05:58,983","00:06:01,152",I went to a lot of parties in my day.,0,0.0,,,,358.98,361.15
88,"00:06:02,320","00:06:06,157",Never been to a good one that had 14-year-old boys in it.,1,1.740000000000009,"#43, ","366.26, ","368.0, ",362.32,366.16
89,"00:06:09,077","00:06:11,371","Not even when I was 13, you know what I mean.",1,2.2800000000000296,"#44, ","370.34, ","372.62, ",369.08,371.37
90,"00:06:15,333","00:06:18,378",Who was the kicker with a bunch of Hubba Bubba chewing niggas like...,1,2.509999999999991,"#45, ","378.22, ","380.73, ",375.33,378.38
91,"00:06:19,462","00:06:21,172","""I'm having a good time, nigga.""",1,2.8000000000000114,"#46, ","382.02, ","384.82, ",379.46,381.17
92,"00:06:25,093","00:06:25,927",Yuck.,0,0.0,,,,385.09,385.93
93,"00:06:27,762","00:06:28,805","Ironically,",0,0.0,,,,387.76,388.81
94,"00:06:29,514","00:06:31,224",the kid grew up to be gay anyway.,0,0.0,,,,389.51,391.22
95,"00:06:32,016","00:06:33,393",Which means...,0,0.0,,,,392.02,393.39
96,"00:06:34,018","00:06:36,854",Kevin Spacey can sniff that shit out like a truffle pig.,0,0.0,,,,394.02,396.85
97,"00:06:39,148","00:06:40,691","""Yeah, he's one of me.""",0,0.0,,,,399.15,400.69
98,"00:06:43,111","00:06:46,155","And not to victim blame, but it seems like the kind of situation",0,0.0,,,,403.11,406.15
99,"00:06:46,239","00:06:48,574",that a gay 14-year-old would get himself into.,1,1.8600000000000136,"#47, ","410.82, ","412.68, ",406.24,408.57
100,"00:06:53,037","00:06:55,998","I know I didn't say that right, but it's true, nigga, like...",1,1.3900000000000432,"#48, ","415.77, ","417.16, ",413.04,416.0
101,"00:06:56,082","00:06:59,210",You know why I said that though? 'Cause I went to an arts high school.,0,0.0,,,,416.08,419.21
102,"00:06:59,293","00:07:01,129","And, like, all them niggas was gay, man.",0,0.0,,,,419.29,421.13
103,"00:07:01,212","00:07:03,756","Like, in a high school, all them dudes was gay.",0,0.0,,,,421.21,423.76
104,"00:07:03,840","00:07:07,301",And them gay dudes is way more mature than the rest of us.,0,0.0,,,,423.84,427.3
105,"00:07:07,385","00:07:10,054","And we didn't know why, we just knew they was mature.",0,0.0,,,,427.38,430.05
106,"00:07:10,138","00:07:11,639",Ever seen a gay dude at lunch?,0,0.0,,,,430.14,431.64
107,"00:07:12,682","00:07:14,475","Perfect posture, they just sitting there.",0,0.0,,,,432.68,434.48
108,"00:07:16,561","00:07:17,937",Eating responsibly.,0,0.0,,,,436.56,437.94
109,"00:07:20,982","00:07:22,692",Then they take that thermos out.,0,0.0,,,,440.98,442.69
110,"00:07:22,775","00:07:24,652","You be like, ""What the fuck is that?""",1,0.589999999999975,"#49, ","444.68, ","445.27, ",442.77,444.65
111,"00:07:26,362","00:07:28,614","""Is this nigga drinking wine with lunch?<i>""</i>",2,4.21999999999997,"#50, #51, ","447.98, 452.21, ","449.52, 454.89, ",446.36,448.61
112,"00:07:35,580","00:07:37,123",We didn't know what it was.,0,0.0,,,,455.58,457.12
113,"00:07:37,874","00:07:40,460",Because we were young boys just trying to figure out who we were.,0,0.0,,,,457.87,460.46
114,"00:07:40,543","00:07:43,546",And we didn't realize these gay dudes were fighting,0,0.0,,,,460.54,463.55
115,"00:07:44,297","00:07:46,257",to be who they knew they already were.,0,0.0,,,,464.3,466.26
116,"00:07:46,841","00:07:48,009",Some impressive shit.,0,0.0,,,,466.84,468.01
117,"00:07:48,509","00:07:52,096","They were fearless, the gay kids. Fucking fearless.",0,0.0,,,,468.51,472.1
118,"00:07:52,180","00:07:54,015",I've never seen a scared gay dude in my life.,0,0.0,,,,472.18,474.01
119,"00:07:54,098","00:07:55,641",What kind of man has no fear?,0,0.0,,,,474.1,475.64
120,"00:07:56,809","00:07:59,937","You could be tied up in a hostage situation with a gay dude,",0,0.0,,,,476.81,479.94
121,"00:08:00,646","00:08:02,940","and them niggas still be like, ""I'm thirsty.""",0,0.0,,,,480.65,482.94
122,"00:08:03,024","00:08:03,858","""Shh.",1,1.5500000000000114,"#52, ","483.52, ","485.07, ",483.02,483.86
123,"00:08:04,609","00:08:06,277","Shh!""",2,2.8899999999999864,"#53, #54, ","486.3, 487.92, ","487.3, 489.81, ",484.61,486.28
124,"00:08:10,114","00:08:13,326","""I'm thirsty, David. I need something to drink.""",0,0.0,,,,490.11,493.33
125,"00:08:13,910","00:08:16,162","""Shh.""",1,0.6299999999999955,"#55, ","496.0, ","496.63, ",493.91,496.16
126,"00:08:21,209","00:08:22,502","""Well, then shoot me.",1,1.2199999999999704,"#56, ","502.18, ","503.4, ",501.21,502.5
127,"00:08:23,503","00:08:25,463",I would rather die of a bullet than dehydration.,0,0.0,,,,503.5,505.46
128,"00:08:25,546","00:08:28,049","Nigga, I am thirsty. I need some water.""",1,1.1399999999999864,"#57, ","508.17, ","509.31, ",505.55,508.05
129,"00:08:35,139","00:08:36,307","All jokes aside,",0,0.0,,,,515.14,516.31
130,"00:08:37,725","00:08:40,228",Kevin Spacey shouldn't have done that shit to that kid.,0,0.0,,,,517.73,520.23
131,"00:08:40,520","00:08:42,063",He was 14-years-old,0,0.0,,,,520.52,522.06
132,"00:08:42,480","00:08:46,067",and was forced to carry a grown man's secret.,0,0.0,,,,522.48,526.07
133,"00:08:46,817","00:08:48,903",For 30 years.,0,0.0,,,,526.82,528.9
134,"00:08:48,986","00:08:52,281","Jesus Christ, he must have been busting at the seams with that one.",0,0.0,,,,528.99,532.28
135,"00:08:52,532","00:08:56,869","The saddest part is, if he were able to carry that secret for six more months,",0,0.0,,,,532.53,536.87
136,"00:08:57,537","00:08:59,789",I would get to know how <i>House of Cards</i> ends.,4,13.330000000000041,"#58, #59, #60, #61, ","539.89, 548.69, 553.53, 555.35, ","546.6, 553.32, 554.97, 555.9, ",537.54,539.79
137,"00:09:16,514","00:09:18,808","Yep, ladies and gentlemen, these are dark...",1,1.3400000000000318,"#62, ","558.35, ","559.69, ",556.51,558.81
138,"00:09:20,226","00:09:21,978","dark, dark times.",0,0.0,,,,560.23,561.98
139,"00:09:25,982","00:09:29,068",<i>New York Times </i>said that Louis CK,0,0.0,,,,565.98,569.07
140,"00:09:29,860","00:09:31,571",jizzed on his own stomach.,1,1.75,"#63, ","573.48, ","575.23, ",569.86,571.57
141,"00:09:35,950","00:09:38,035","Now, I've busted a lot of nuts in my day.",0,0.0,,,,575.95,578.03
142,"00:09:38,744","00:09:40,204",None of them were newsworthy.,1,2.3799999999999955,"#64, ","580.13, ","582.51, ",578.74,580.2
143,"00:09:43,416","00:09:46,085",Shit was really gross. 'Cause they didn't just say it like I said it.,0,0.0,,,,583.42,586.09
144,"00:09:46,168","00:09:47,587","They didn't just say, ""Jizz on the stomach.""",0,0.0,,,,586.17,587.59
145,"00:09:47,670","00:09:51,549",They said it in that fucking Pulitzer prize-winning style,0,0.0,,,,587.67,591.55
146,"00:09:51,632","00:09:52,717",that the <i>New York Times </i>has.,0,0.0,,,,591.63,592.72
147,"00:09:52,800","00:09:55,344","It was very descriptive, like, you know what I mean?",0,0.0,,,,592.8,595.34
148,"00:09:56,596","00:10:01,392","""Louis CK's semen shot out like a volcano of misogyny<i>,</i>",0,0.0,,,,596.6,601.39
149,"00:10:02,268","00:10:06,230","slowly drizzling down like lava<i>,</i>",1,2.240000000000009,"#65, ","605.84, ","608.08, ",602.27,606.23
150,"00:10:07,940","00:10:10,484",covering his freckled penis,0,0.0,,,,607.94,610.48
151,"00:10:11,193","00:10:13,029",as it slowly dripped,0,0.0,,,,611.19,613.03
152,"00:10:13,529","00:10:16,407","to a fiery crown of red hair.""",1,1.1600000000000819,"#66, ","615.43, ","616.59, ",613.53,616.41
153,"00:10:17,742","00:10:21,495","Like, Jesus Christ, I'm trying to eat some <i>huevos rancheros, </i>and this nigga is...",4,6.269999999999982,"#67, #68, #69, #70, ","620.13, 621.76, 624.86, 627.48, ","621.25, 623.55, 626.49, 629.21, ",617.74,621.5
154,"00:10:29,170","00:10:32,840",And you know the tough part of being a comedian is knowing the motherfuckers.,0,0.0,,,,629.17,632.84
155,"00:10:32,923","00:10:35,259","Everybody comes up to me like, ""Did you know?",0,0.0,,,,632.92,635.26
156,"00:10:35,843","00:10:37,595","Did you know what Louis was doing?""",0,0.0,,,,635.84,637.6
157,"00:10:37,678","00:10:39,680","""No, bitch. I did not know.""",1,1.3000000000000682,"#71, ","639.67, ","640.97, ",637.68,639.68
158,"00:10:40,765","00:10:42,892",The fuck you think we talk about at the comedy club?,0,0.0,,,,640.76,642.89
159,"00:10:42,975","00:10:44,018","""Hey, how was the weekend?""",0,0.0,,,,642.98,644.02
160,"00:10:44,101","00:10:46,270","""Great, man. I was just jerking off in faces",0,0.0,,,,644.1,646.27
161,"00:10:46,354","00:10:48,898","and cumming on my own stomach, having a good time.",1,1.1299999999999955,"#72, ","646.38, ","647.51, ",646.35,648.9
162,"00:10:48,981","00:10:50,566","You know how this business is.""",1,1.2799999999999727,"#73, ","650.74, ","652.02, ",648.98,650.57
163,"00:10:52,443","00:10:53,611","No, I didn't know.",0,0.0,,,,652.44,653.61
164,"00:10:54,236","00:10:56,155",They act like we sit around like <i>Grease.</i>,0,0.0,,,,654.24,656.15
165,"00:10:56,238","00:10:59,367","<i>♪ Tell me more, tell me more</i> <i>Did she put up a fight?</i> ♪",3,4.300000000000068,"#74, #75, #76, ","660.45, 662.8, 665.28, ","661.89, 664.48, 666.46, ",656.24,659.37
166,"00:11:06,624","00:11:09,502","Sorry, I don't know the choreography, but you get the point.",1,1.6299999999999955,"#77, ","668.07, ","669.7, ",666.62,669.5
167,"00:11:09,627","00:11:10,961",You get the point.,1,0.5099999999999909,"#78, ","672.27, ","672.78, ",669.63,670.96
168,"00:11:13,172","00:11:14,340",Shit was intense.,0,0.0,,,,673.17,674.34
169,"00:11:16,425","00:11:17,885",But Louis was like the turning point.,0,0.0,,,,676.42,677.88
170,"00:11:17,968","00:11:20,137","I mean, you know, all these allegations are terrible.",0,0.0,,,,677.97,680.14
171,"00:11:20,221","00:11:23,057","Louis's was the only-- I shouldn't say this but fuck it,",0,0.0,,,,680.22,683.06
172,"00:11:23,849","00:11:27,228",his allegation was the only one that made me like laugh.,2,1.7900000000000773,"#79, #80, ","687.67, 690.26, ","688.34, 691.38, ",683.85,687.23
173,"00:11:31,565","00:11:33,109","Well, if you think about it...",2,1.7899999999999636,"#81, #82, ","693.23, 694.94, ","694.07, 695.89, ",691.57,693.11
174,"00:11:36,195","00:11:37,697",Because all his friends are reading it,0,0.0,,,,696.2,697.7
175,"00:11:37,780","00:11:40,366",and he's jerking off and he's surprising people.,0,0.0,,,,697.78,700.37
176,"00:11:40,449","00:11:42,410","He's surprising them, he's jerking off.",2,2.769999999999982,"#83, #84, ","701.94, 704.63, ","703.6, 705.74, ",700.45,702.41
177,"00:11:46,914","00:11:50,751","I just picture all the comics in comedy just reading that like, ""What?""",1,1.7799999999999727,"#85, ","710.38, ","712.16, ",706.91,710.75
178,"00:11:55,256","00:11:57,883","It's terrible. I know, it's terrible. I'm sorry, ladies.",0,0.0,,,,715.26,717.88
179,"00:11:57,967","00:11:59,510",You're right. You are right.,0,0.0,,,,717.97,719.51
180,"00:12:00,511","00:12:03,639","But at the same time, I mean, you know what I mean. I don't know.",0,0.0,,,,720.51,723.64
181,"00:12:04,724","00:12:07,518","Jesus Christ, they took everything from Louis. That was like...",0,0.0,,,,724.72,727.52
182,"00:12:08,227","00:12:11,188","I don't know, it might be disproportionate. I can't tell.",0,0.0,,,,728.23,731.19
183,"00:12:11,939","00:12:14,692",I can't tell. This is like where it's hard to be a man.,0,0.0,,,,731.94,734.69
184,"00:12:16,026","00:12:19,196","One lady said, ""Louis CK masturbated in front of me,",0,0.0,,,,736.03,739.2
185,"00:12:20,489","00:12:22,366","ruined my comedy dreams.""",0,0.0,,,,740.49,742.37
186,"00:12:22,450","00:12:23,325",Word?,1,3.5599999999999454,"#86, ","743.73, ","747.29, ",742.45,743.33
187,"00:12:27,496","00:12:29,081","Well, then I dare say, Madam, you may have never had a dream.",1,1.3700000000000045,"#87, ","751.58, ","752.95, ",747.5,749.08
188,"00:12:34,086","00:12:36,005","Come on, man. That's a brittle spirit.",1,0.9900000000000091,"#88, ","756.1, ","757.09, ",754.09,756.0
189,"00:12:39,925","00:12:43,053",That is a brittle-ass spirit. That shit is too much.,0,0.0,,,,759.92,763.05
190,"00:12:43,137","00:12:44,472",This is a grown-ass woman.,0,0.0,,,,763.14,764.47
191,"00:12:45,181","00:12:47,725",You know what this shit is like? It's like COINTELPRO.,0,0.0,,,,765.18,767.73
192,"00:12:47,808","00:12:48,976",You know what that is?,0,0.0,,,,767.81,768.98
193,"00:12:49,560","00:12:52,021",It's the programming the FBI had on J. Edgar Hoover.,0,0.0,,,,769.56,772.02
194,"00:12:52,104","00:12:54,940","In this program, one of the many things they did",0,0.0,,,,772.1,774.94
195,"00:12:55,024","00:12:58,736",was they would track the sexual habits of anyone,0,0.0,,,,775.02,778.74
196,"00:12:58,819","00:13:01,113",they considered an enemy of the state.,0,0.0,,,,778.82,781.11
197,"00:13:01,447","00:13:04,158",It's a loop button. That's why they've got all these fucking sex tapes,0,0.0,,,,781.45,784.16
198,"00:13:04,241","00:13:05,951",with Martin Luther King fucking bitches.,0,0.0,,,,784.24,785.95
199,"00:13:06,035","00:13:08,871","But lucky for us, he actually had a dream.",1,1.4200000000000728,"#89, ","789.06, ","790.48, ",786.03,788.87
200,"00:13:13,209","00:13:16,378","You think if Louis CK jerked off in front of Dr. King, he'd be like,",0,0.0,,,,793.21,796.38
201,"00:13:16,462","00:13:18,589","""I can't continue this movement.",2,1.4800000000000182,"#90, #91, ","798.39, 800.39, ","799.26, 801.0, ",796.46,798.59
202,"00:13:20,925","00:13:24,470","I'm sorry, but the freedom of black people must be stopped.",0,0.0,,,,800.92,804.47
203,"00:13:25,805","00:13:29,850",I didn't know this nigga was going to pull this dick out and jerk off like this.,0,0.0,,,,805.8,809.85
204,"00:13:29,934","00:13:32,394","I just thought we were gonna get a couple drinks and chill.""",1,1.5199999999999818,"#92, ","812.95, ","814.47, ",809.93,812.39
205,"00:13:37,149","00:13:40,194",Show business is just harder than that. Them women sounding like...,0,0.0,,,,817.15,820.19
206,"00:13:40,277","00:13:42,363","I hate to say it, y'all, they sound weak.",0,0.0,,,,820.28,822.36
207,"00:13:43,072","00:13:45,282","I know it sounds fucked up. I'm not supposed to say that,",0,0.0,,,,823.07,825.28
208,"00:13:45,366","00:13:48,410","but one of these ladies was like, ""Louis CK was masturbating",0,0.0,,,,825.37,828.41
209,"00:13:48,494","00:13:50,412","while I was on the phone with him.""",0,0.0,,,,828.49,830.41
210,"00:13:51,330","00:13:53,207","Bitch, you don't know how to hang up a phone?",2,4.669999999999959,"#93, #94, ","832.82, 835.24, ","834.29, 838.44, ",831.33,833.21
211,"00:13:58,379","00:14:02,341",How the fuck are you going to survive in show business,0,0.0,,,,838.38,842.34
212,"00:14:03,509","00:14:06,470",if this is an actual obstacle to your dreams?,0,0.0,,,,843.51,846.47
213,"00:14:07,596","00:14:09,265","I know Louis is wrong, man.",0,0.0,,,,847.6,849.26
214,"00:14:09,348","00:14:12,226","I'm just saying, I'm held to a higher standard of accountability",0,0.0,,,,849.35,852.23
215,"00:14:12,309","00:14:13,394",than these women are.,0,0.0,,,,852.31,853.39
216,"00:14:13,936","00:14:15,229",Don't forget who I am.,0,0.0,,,,853.94,855.23
217,"00:14:15,896","00:14:17,273",Don't forget what I am.,0,0.0,,,,855.9,857.27
218,"00:14:17,731","00:14:19,775",I am a black dude.,0,0.0,,,,857.73,859.77
219,"00:14:21,735","00:14:24,154",And don't ever forget how I got here.,0,0.0,,,,861.74,864.15
220,"00:14:25,114","00:14:26,532",My ancestors were kidnapped.,0,0.0,,,,865.11,866.53
221,"00:14:26,615","00:14:28,284",I don't even know where the fuck I'm from.,0,0.0,,,,866.62,868.28
222,"00:14:28,951","00:14:30,828",They were put on the bottom of boats.,0,0.0,,,,868.95,870.83
223,"00:14:31,537","00:14:33,455",They sailed them across the Atlantic.,0,0.0,,,,871.54,873.46
