,start_time,end_time,line,value,duration,tracks,laugh_start,laugh_end,start_sec,end_sec
944,"00:53:46,598","00:53:50,227","and sometimes you had to crawl this far under, we're sinking in the mud",0,0.0,,,,3226.6,3230.23
945,"00:53:50,310","00:53:52,312","like, to our knees and...",0,0.0,,,,3230.31,3232.31
946,"00:53:52,395","00:53:55,899","three hours up the mountain at some point, I was like...",0,0.0,,,,3232.39,3235.9
947,"00:53:57,317","00:53:59,736",♪Happy birthday...♪,2,1.2400000000002365,"#253, #254, ","3239.35, 3241.14, ","3239.92, 3241.81, ",3237.32,3239.74
948,"00:53:59,819","00:54:01,154",[crowd laughs],0,0.0,,,,3239.82,3241.15
949,"00:54:01,279","00:54:02,530",♪to me♪,1,1.400000000000091,"#255, ","3243.92, ","3245.32, ",3241.28,3242.53
950,"00:54:04,074","00:54:06,326",♪Happy birthday...♪,1,1.7699999999999818,"#256, ","3245.78, ","3247.55, ",3244.07,3246.33
951,"00:54:07,118","00:54:08,161",♪to me.♪,1,1.0099999999997635,"#257, ","3248.69, ","3249.7, ",3247.12,3248.16
952,"00:54:08,745","00:54:09,621",[gasps],0,0.0,,,,3248.74,3249.62
953,"00:54:09,704","00:54:11,873",♪Happy birthday...♪,0,0.0,,,,3249.7,3251.87
954,"00:54:13,583","00:54:15,168",♪dear Ellen♪,1,0.5799999999999272,"#258, ","3256.02, ","3256.6, ",3253.58,3255.17
955,"00:54:16,253","00:54:18,713","Oh my God, it was so hard but...",0,0.0,,,,3256.25,3258.71
956,"00:54:18,797","00:54:20,966",It is so worth it 'cause when you get there,0,0.0,,,,3258.8,3260.97
957,"00:54:21,049","00:54:23,468",and you see this thing five feet away from you...,0,0.0,,,,3261.05,3263.47
958,"00:54:24,177","00:54:26,513","So majestic, so beautiful.",1,3.2899999999999636,"#259, ","3266.23, ","3269.52, ",3264.18,3266.51
959,"00:54:27,222","00:54:29,224",[claps],1,3.4600000000000364,"#260, ","3270.08, ","3273.54, ",3267.22,3269.22
960,"00:54:32,644","00:54:36,022",Portia and I took a picture and  this guy photobombed us back there.,0,0.0,,,,3272.64,3276.02
961,"00:54:38,775","00:54:41,111","But yet, so you can see like her hair is soaking wet",0,0.0,,,,3278.78,3281.11
962,"00:54:41,194","00:54:43,071",she's got mud on her face and we're...,0,0.0,,,,3281.19,3283.07
963,"00:54:43,154","00:54:45,824",So we get down to the bottom and we take a picture with our group,1,0.6300000000001091,"#261, ","3284.52, ","3285.15, ",3283.15,3285.82
964,"00:54:45,907","00:54:47,993","that we went with, and you can see the mud where...",0,0.0,,,,3285.91,3287.99
965,"00:54:48,076","00:54:50,704",we had all fallen and sank into the mud.,0,0.0,,,,3288.08,3290.7
966,"00:54:50,787","00:54:53,790","If you wanna see how happy I am, if you'll zoom in on my fist there....",1,1.2100000000000364,"#262, ","3294.44, ","3295.65, ",3290.79,3293.79
967,"00:54:54,499","00:54:56,501",[crowd laughs],0,0.0,,,,3294.5,3296.5
968,"00:54:57,127","00:54:58,003",Yeah.,0,0.0,,,,3297.13,3298.0
969,"00:55:01,631","00:55:02,465",That's...,0,0.0,,,,3301.63,3302.47
970,"00:55:03,883","00:55:06,094","That's my ""Happy Birthday"" fist right there.",0,0.0,,,,3303.88,3306.09
971,"00:55:08,430","00:55:09,264",Yeah.,1,2.269999999999982,"#263, ","3310.02, ","3312.29, ",3308.43,3309.26
972,"00:55:14,853","00:55:16,980","The thing is, I didn't pack correctly.",0,0.0,,,,3314.85,3316.98
973,"00:55:17,063","00:55:20,066",That's what was wrong because I packed to go on Safari,0,0.0,,,,3317.06,3320.07
974,"00:55:20,150","00:55:21,401",and I looked good.,0,0.0,,,,3320.15,3321.4
975,"00:55:21,484","00:55:24,696",I went on safari and I looked like I should have been on safari.,0,0.0,,,,3321.48,3324.7
976,"00:55:24,779","00:55:27,282","I didn't have waterproof clothes, I didn't have waterproof shoes",0,0.0,,,,3324.78,3327.28
977,"00:55:27,365","00:55:28,575",I didn't have the right things.,0,0.0,,,,3327.36,3328.57
978,"00:55:28,658","00:55:30,618","But I find, when we go on vacation",0,0.0,,,,3328.66,3330.62
979,"00:55:30,785","00:55:34,289","we pack for who we want to be, we pack for this...",0,0.0,,,,3330.78,3334.29
980,"00:55:34,372","00:55:38,084",fantasy personality that we're gonna have when we go away.,0,0.0,,,,3334.37,3338.08
981,"00:55:38,960","00:55:42,922","When we're on an island, they don't know we don't wear white linen all the time.",1,0.849999999999909,"#264, ","3343.62, ","3344.47, ",3338.96,3342.92
982,"00:55:43,965","00:55:45,508",Beads in a big floppy hat.,0,0.0,,,,3343.97,3345.51
983,"00:55:45,592","00:55:47,093","That's who we are, you know.",0,0.0,,,,3345.59,3347.09
984,"00:55:48,428","00:55:51,389","We just, we're like: ""Well, for sure I'm gonna work out",0,0.0,,,,3348.43,3351.39
985,"00:55:51,473","00:55:53,850","'cause there's a gym in the hotel, so I'm gonna bring my...",0,0.0,,,,3351.47,3353.85
986,"00:55:53,975","00:55:57,312","running shoes, I'll run on the beach every day. And then I'll do...",0,0.0,,,,3353.97,3357.31
987,"00:55:57,437","00:55:59,189",yoga on the pier.,0,0.0,,,,3357.44,3359.19
988,"00:55:59,272","00:56:01,316","I've seen that in the brochure, and...",1,0.8800000000001091,"#265, ","3362.77, ","3363.65, ",3359.27,3361.32
989,"00:56:02,984","00:56:05,904",I'll bring a poncho in case there's a bonfire on the beach.,0,0.0,,,,3362.98,3365.9
990,"00:56:05,987","00:56:07,781",I'll wanna have a poncho on.,0,0.0,,,,3365.99,3367.78
991,"00:56:08,615","00:56:11,409",I'll bring a gown in case there's a captain from a boat,0,0.0,,,,3368.61,3371.41
992,"00:56:11,493","00:56:13,119",that I have to have dinner with.,0,0.0,,,,3371.49,3373.12
993,"00:56:13,203","00:56:15,205",[crowd laughs],0,0.0,,,,3373.2,3375.2
994,"00:56:16,956","00:56:19,084","I'll bring some books, I'll read for sure.",0,0.0,,,,3376.96,3379.08
995,"00:56:19,167","00:56:20,001",I'm gonna read.,0,0.0,,,,3379.17,3380.0
996,"00:56:21,294","00:56:24,464","I don't read at home, but I'm gonna read there, I'll have a lot of time.",0,0.0,,,,3381.29,3384.46
997,"00:56:24,839","00:56:27,634","I'm there three days, I'll bring six books and...",1,1.0399999999999636,"#266, ","3388.89, ","3389.93, ",3384.84,3387.63
998,"00:56:29,052","00:56:29,886",Yeah.,0,0.0,,,,3389.05,3389.89
999,"00:56:31,429","00:56:35,016","Cut to you, sitting at a bar, drunk, in the same outfit the entire time.",1,5.710000000000036,"#267, ","3396.43, ","3402.14, ",3391.43,3395.02
1000,"00:56:35,183","00:56:37,185",[crowd laughs],0,0.0,,,,3395.18,3397.18
1001,"00:56:38,686","00:56:40,688",[claps],1,1.930000000000291,"#268, ","3403.39, ","3405.32, ",3398.69,3400.69
1002,"00:56:47,946","00:56:51,449",I love that we imagine that we're gonna curl up and read a good book.,0,0.0,,,,3407.95,3411.45
1003,"00:56:51,533","00:56:52,534",I love that expression.,0,0.0,,,,3411.53,3412.53
1004,"00:56:52,617","00:56:54,828",I'm gonna go curl up and read a good book like...,0,0.0,,,,3412.62,3414.83
1005,"00:56:54,911","00:56:57,580","You don't curl up for a magazine, you don't curl up for...",0,0.0,,,,3414.91,3417.58
1006,"00:56:57,664","00:56:58,915","Although, when I read the paper",0,0.0,,,,3417.66,3418.91
1007,"00:56:58,998","00:57:01,334","I curl up in the fetal position now, that's...",1,5.570000000000164,"#269, ","3421.85, ","3427.42, ",3419.0,3421.33
1008,"00:57:02,085","00:57:03,420",That's for sure.,0,0.0,,,,3422.09,3423.42
1009,"00:57:03,503","00:57:05,505",[crowd claps],1,1.3699999999998909,"#270, ","3428.96, ","3430.33, ",3423.5,3425.51
1010,"00:57:09,926","00:57:13,471","But I do love these expressions. ""Curl up and read a good book"" or",0,0.0,,,,3429.93,3433.47
1011,"00:57:13,555","00:57:15,765","you know, ""a bird in the hand is worth two in the bush"".",0,0.0,,,,3433.55,3435.76
1012,"00:57:15,849","00:57:17,684",Did someone have a bird in the hand,0,0.0,,,,3435.85,3437.68
1013,"00:57:17,767","00:57:19,727","and said: ""There's two in the bush.",0,0.0,,,,3437.77,3439.73
1014,"00:57:19,811","00:57:21,771","Yeah, but I got one in the hand so...",0,0.0,,,,3439.81,3441.77
1015,"00:57:22,981","00:57:25,358","-But there's two in the bush. -Yes, but I got one in the hand",0,0.0,,,,3442.98,3445.36
1016,"00:57:25,442","00:57:27,110",and that's worth two in the bush.,0,0.0,,,,3445.44,3447.11
1017,"00:57:27,527","00:57:29,070",-It is? -Yes,0,0.0,,,,3447.53,3449.07
1018,"00:57:29,154","00:57:31,281","one in the hand is worth two in the bush.""",0,0.0,,,,3449.15,3451.28
1019,"00:57:34,033","00:57:35,702",Why do you call it  the  hand?,0,0.0,,,,3454.03,3455.7
1020,"00:57:35,785","00:57:36,744",It's your hand.,0,0.0,,,,3455.78,3456.74
1021,"00:57:36,828","00:57:38,204","Why do you say ""the hand""?",1,0.5599999999999454,"#271, ","3457.65, ","3458.21, ",3456.83,3458.2
1022,"00:57:38,455","00:57:40,457",[crowd laughs],0,0.0,,,,3458.45,3460.46
1023,"00:57:43,376","00:57:44,210","""For Pete's sake!""",0,0.0,,,,3463.38,3464.21
1024,"00:57:44,294","00:57:46,838","Who is Pete, and why are we doing everything for his sake?",0,0.0,,,,3464.29,3466.84
1025,"00:57:46,963","00:57:48,923",[crowd laughs],0,0.0,,,,3466.96,3468.92
1026,"00:57:50,258","00:57:51,217","""Fit as a fiddle.""",0,0.0,,,,3470.26,3471.22
1027,"00:57:51,301","00:57:53,303",Is that a good shape? I don't know.,1,0.680000000000291,"#272, ","3472.99, ","3473.67, ",3471.3,3473.3
1028,"00:57:53,470","00:57:55,472",[crowd claps],0,0.0,,,,3473.47,3475.47
1029,"00:58:01,060","00:58:04,022","My favorite expression is, ""best thing since sliced bread.""",1,0.8699999999998909,"#273, ","3484.17, ","3485.04, ",3481.06,3484.02
1030,"00:58:05,064","00:58:07,358","Really, Is that the benchmark right there? That's...",0,0.0,,,,3485.06,3487.36
1031,"00:58:07,567","00:58:09,569",[crowd laughs],0,0.0,,,,3487.57,3489.57
1032,"00:58:12,113","00:58:14,032",Sliced bread really came about--,0,0.0,,,,3492.11,3494.03
1033,"00:58:14,115","00:58:17,368","In 1928 somebody decided to slice it, in 1928.",0,0.0,,,,3494.11,3497.37
1034,"00:58:17,452","00:58:20,205",That's not that long ago. Bread has been around forever.,0,0.0,,,,3497.45,3500.2
1035,"00:58:20,288","00:58:22,999",Jesus broke bread. He didn't even know how to slice it.,1,1.0499999999997272,"#274, ","3509.07, ","3510.12, ",3500.29,3503.0
1036,"00:58:23,249","00:58:25,251",[crowd laughs],0,0.0,,,,3503.25,3505.25
1037,"00:58:30,882","00:58:33,259","I mean all throughout history, no one sliced it?",0,0.0,,,,3510.88,3513.26
1038,"00:58:33,343","00:58:36,137","Like, soldiers with swords, they're putting their swords down",0,0.0,,,,3513.34,3516.14
1039,"00:58:36,221","00:58:38,598","so they could grab bread and gnaw on it, like...",1,0.8899999999998727,"#275, ","3519.86, ","3520.75, ",3516.22,3518.6
1040,"00:58:41,142","00:58:42,852","They probably ""took a stab at it""",0,0.0,,,,3521.14,3522.85
1041,"00:58:42,936","00:58:45,522",which is where that expression came from. They stabbed at it...,1,1.300000000000182,"#276, ","3524.75, ","3526.05, ",3522.94,3525.52
1042,"00:58:45,605","00:58:46,648",with their sword.,0,0.0,,,,3525.61,3526.65
1043,"00:58:46,773","00:58:48,316","Nothing happened, so they just...",1,1.099999999999909,"#277, ","3527.61, ","3528.71, ",3526.77,3528.32
1044,"00:58:54,656","00:58:58,284","And then finally, in 1928, some gay guy, you know he was gay, for sure.",0,0.0,,,,3534.66,3538.28
1045,"00:58:58,368","00:58:59,202",I mean...,0,0.0,,,,3538.37,3539.2
1046,"00:58:59,369","00:59:00,495",[crowd laughs],0,0.0,,,,3539.37,3540.49
1047,"00:59:01,079","00:59:03,289","""I refuse to be a barbarian anymore.",0,0.0,,,,3541.08,3543.29
1048,"00:59:05,083","00:59:06,251",I'm slicing it.,0,0.0,,,,3545.08,3546.25
1049,"00:59:09,212","00:59:10,088","Heathens.""",0,0.0,,,,3549.21,3550.09
1050,"00:59:13,716","00:59:15,426","He was popular, too. I mean, the fact",0,0.0,,,,3553.72,3555.43
1051,"00:59:15,510","00:59:18,304","that he has that, you know, title of sliced bread....",0,0.0,,,,3555.51,3558.3
1052,"00:59:18,388","00:59:20,098",Like he was probably at a party in the '20s.,0,0.0,,,,3558.39,3560.1
1053,"00:59:20,181","00:59:22,600",Can you imagine that Thomas Edison is there,0,0.0,,,,3560.18,3562.6
1054,"00:59:22,684","00:59:25,270",and the Wright brothers and...,0,0.0,,,,3562.68,3565.27
1055,"00:59:25,353","00:59:28,606","""Is the guy who sliced the bread here? I heard he was coming to the party.",0,0.0,,,,3565.35,3568.61
1056,"00:59:29,315","00:59:30,275","Is he here?""",0,0.0,,,,3569.32,3570.28
1057,"00:59:34,612","00:59:36,489","I mean, it should be like best thing since...",0,0.0,,,,3574.61,3576.49
1058,"00:59:36,573","00:59:39,200","fire, or the wheel, or the ladder.",0,0.0,,,,3576.57,3579.2
1059,"00:59:39,409","00:59:40,285",You know...,0,0.0,,,,3579.41,3580.28
1060,"00:59:40,368","00:59:42,078","I mean, the ladder, we take that for granted.",0,0.0,,,,3580.37,3582.08
1061,"00:59:42,161","00:59:44,497",I know you don't think that's as important but it really is.,0,0.0,,,,3582.16,3584.5
1062,"00:59:44,581","00:59:45,957",What did we do before the ladder?,0,0.0,,,,3584.58,3585.96
1063,"00:59:46,040","00:59:48,793",We all had to have a tall friend to reach things for us.,0,0.0,,,,3586.04,3588.79
1064,"00:59:48,876","00:59:49,711",You know...,0,0.0,,,,3588.88,3589.71
1065,"00:59:49,794","00:59:52,088",It was probably a tall guy who invented the ladder going:,0,0.0,,,,3589.79,3592.09
1066,"00:59:52,171","00:59:54,549","""I have aspirations of my own. I am not gonna...",1,0.5599999999999454,"#278, ","3595.42, ","3595.98, ",3592.17,3594.55
1067,"00:59:55,550","00:59:57,594","continue to do this the whole time.""",0,0.0,,,,3595.55,3597.59
1068,"00:59:59,345","01:00:01,347",[claps],1,0.9599999999995816,"#279, ","3600.51, ","3601.47, ",3599.34,3601.35
1069,"01:00:03,224","01:00:06,060",The ladder is an adult purchase if you really think about it.,0,0.0,,,,3603.22,3606.06
1070,"01:00:06,144","01:00:07,895",You don't buy a ladder when you're a teenager.,0,0.0,,,,3606.14,3607.89
1071,"01:00:07,979","01:00:10,023",You buy a ladder when you're an adult.,0,0.0,,,,3607.98,3610.02
1072,"01:00:10,523","01:00:13,192","When when you have a house, and the bigger the house the more ladders.",0,0.0,,,,3610.52,3613.19
1073,"01:00:13,276","01:00:14,611",I have a lot of ladders...,0,0.0,,,,3613.28,3614.61
1074,"01:00:16,571","01:00:18,156","I have a six-foot, I have an eight-foot",0,0.0,,,,3616.57,3618.16
1075,"01:00:18,239","01:00:20,450","I have the extension, the 20-foot aluminum.",0,0.0,,,,3618.24,3620.45
1076,"01:00:20,575","01:00:23,661","And when I married Portia, she had a little ladder.",0,0.0,,,,3620.57,3623.66
1077,"01:00:23,745","01:00:26,706","So I have a step ladder, but I love it just the same, I do.",2,6.709999999999582,"#280, #281, ","3626.17, 3628.05, ","3627.21, 3633.72, ",3623.74,3626.71
1078,"01:00:27,040","01:00:29,042",[crowd laughs],0,0.0,,,,3627.04,3629.04
1079,"01:00:31,836","01:00:33,838",[claps],1,2.0700000000001637,"#282, ","3635.43, ","3637.5, ",3631.84,3633.84
1080,"01:00:37,383","01:00:38,509",I wrote that at 3 a.m.,0,0.0,,,,3637.38,3638.51
1081,"01:00:38,593","01:00:41,429",I thought either this is gonna be the worst joke I've ever written...,2,1.889999999999418,"#283, #284, ","3640.55, 3641.98, ","3641.72, 3642.7, ",3638.59,3641.43
1082,"01:00:42,347","01:00:43,264",or the best.,1,7.0300000000002,"#285, ","3643.45, ","3650.48, ",3642.35,3643.26
1083,"01:00:43,723","01:00:45,141","I've decided, it's the best.",0,0.0,,,,3643.72,3645.14
1084,"01:00:45,683","01:00:47,685",[crowd cheers],0,0.0,,,,3645.68,3647.68
1085,"01:00:48,061","01:00:50,063",[claps],0,0.0,,,,3648.06,3650.06
1086,"01:00:53,316","01:00:55,818","I think a junk drawer, that also is an adult thing",0,0.0,,,,3653.32,3655.82
1087,"01:00:55,902","01:00:58,529",that happens when we're adults. We get a junk drawer.,0,0.0,,,,3655.9,3658.53
1088,"01:00:58,613","01:01:01,824","If you go home, we all have the same stuff in our junk drawer.",0,0.0,,,,3658.61,3661.82
1089,"01:01:01,908","01:01:03,576",We all have-- For some reason we won't throw,0,0.0,,,,3661.91,3663.58
1090,"01:01:03,660","01:01:05,953",a rubber band away There are tons of rubber bands,0,0.0,,,,3663.66,3665.95
1091,"01:01:06,037","01:01:08,164","like 24 rubber bands are in there, like...",0,0.0,,,,3666.04,3668.16
1092,"01:01:08,414","01:01:11,793","in case, a bunch of little girls come over for pigtails one day. I don't know...",0,0.0,,,,3668.41,3671.79
1093,"01:01:16,214","01:01:18,299",There's a red ink pen in there just...,0,0.0,,,,3676.21,3678.3
1094,"01:01:18,383","01:01:21,552","in case you have to grade papers or something. I don't know, just like...",1,0.849999999999909,"#286, ","3680.61, ","3681.46, ",3678.38,3681.55
1095,"01:01:24,889","01:01:26,224",There's a roll of Scotch tape,0,0.0,,,,3684.89,3686.22
1096,"01:01:26,307","01:01:29,018","that's out of the container, just the roll, and it's...",1,0.6999999999998181,"#287, ","3689.17, ","3689.87, ",3686.31,3689.02
1097,"01:01:29,769","01:01:33,231",You can't get it started 'cause it's half-way broken anyway,1,2.0399999999999636,"#288, ","3693.32, ","3695.36, ",3689.77,3693.23
1098,"01:01:33,564","01:01:34,649",and you just keep it.,0,0.0,,,,3693.56,3694.65
1099,"01:01:35,149","01:01:38,361","There's a AA battery. Does it work? I don't know, I just don't...",0,0.0,,,,3695.15,3698.36
1100,"01:01:38,945","01:01:40,154",I put it in there.,0,0.0,,,,3698.95,3700.15
1101,"01:01:40,780","01:01:42,782",[claps],0,0.0,,,,3700.78,3702.78
1102,"01:01:45,451","01:01:47,745",There's a key and you don't know what it's to.,0,0.0,,,,3705.45,3707.74
1103,"01:01:50,415","01:01:52,959","You won't throw it away, 'cause what if someone finds it",0,0.0,,,,3710.41,3712.96
1104,"01:01:53,042","01:01:54,961",and opens something? What do they... like...,1,2.5799999999999272,"#289, ","3714.3, ","3716.88, ",3713.04,3714.96
1105,"01:01:56,546","01:01:57,880","Walk around, opening...",0,0.0,,,,3716.55,3717.88
1106,"01:01:58,297","01:02:00,299",[crowd laughs],0,0.0,,,,3718.3,3720.3
1107,"01:02:04,053","01:02:07,056",I heard someone say that a junk drawer is a metaphor for your life.,0,0.0,,,,3724.05,3727.06
1108,"01:02:07,140","01:02:09,892",Like we're holding on to things that we don't need to hold on to,0,0.0,,,,3727.14,3729.89
1109,"01:02:09,976","01:02:12,019",that we should let go of. I don't know if that's true.,0,0.0,,,,3729.98,3732.02
1110,"01:02:12,103","01:02:16,274",People are always looking into things and looking for signs of what things mean.,0,0.0,,,,3732.1,3736.27
1111,"01:02:16,691","01:02:17,650","I don't know, I...",0,0.0,,,,3736.69,3737.65
1112,"01:02:17,775","01:02:19,235","For a while there, I was...",0,0.0,,,,3737.78,3739.24
1113,"01:02:19,318","01:02:21,946",Every time I looked at the clock it was 11:11,0,0.0,,,,3739.32,3741.95
1114,"01:02:22,029","01:02:25,408","and every time, and I started wondering, like, what does this mean?",0,0.0,,,,3742.03,3745.41
1115,"01:02:25,491","01:02:27,702","And for me it was a dead battery, but...",1,2.1599999999998545,"#290, ","3748.02, ","3750.18, ",3745.49,3747.7
1116,"01:02:27,994","01:02:29,996",[crowd laughs],0,0.0,,,,3747.99,3750.0
1117,"01:02:32,498","01:02:34,500",[claps],2,1.5499999999997272,"#291, #292, ","3758.83, 3760.79, ","3759.49, 3761.68, ",3752.5,3754.5
1118,"01:02:42,550","01:02:46,596","We all have people, that we know, that look into signs way too much.",0,0.0,,,,3762.55,3766.6
1119,"01:02:46,679","01:02:50,266","You know, they'll be like: ""I don't know if I should be in this relationship.",0,0.0,,,,3766.68,3770.27
1120,"01:02:50,349","01:02:53,144",There's a squirrel. Squirrels live in trees. Trees have leaves.,0,0.0,,,,3770.35,3773.14
1121,"01:02:53,227","01:02:54,103","I should leave him.""",1,0.6700000000000728,"#293, ","3774.59, ","3775.26, ",3773.23,3774.1
1122,"01:02:54,312","01:02:56,314",[crowd laughs],0,0.0,,,,3774.31,3776.31
1123,"01:03:01,110","01:03:02,737",I think we're all looking for signs,0,0.0,,,,3781.11,3782.74
1124,"01:03:02,820","01:03:05,698",because we're all looking for validation that we're on the right path.,0,0.0,,,,3782.82,3785.7
1125,"01:03:05,782","01:03:07,450",And when we see signs like that,0,0.0,,,,3785.78,3787.45
1126,"01:03:07,909","01:03:10,161",we think that means that we're on the right path,0,0.0,,,,3787.91,3790.16
1127,"01:03:10,244","01:03:12,288","which by the way, we are all on a path.",0,0.0,,,,3790.24,3792.29
1128,"01:03:12,371","01:03:14,373",We're all on our own individual path.,0,0.0,,,,3792.37,3794.37
1129,"01:03:14,457","01:03:16,542",Nobody should be on anybody else's path.,0,0.0,,,,3794.46,3796.54
1130,"01:03:16,626","01:03:18,252",We should be on our own path.,1,6.320000000000164,"#294, ","3798.2, ","3804.52, ",3796.63,3798.25
1131,"01:03:18,836","01:03:20,838",[crowd claps],0,0.0,,,,3798.84,3800.84
1132,"01:03:24,175","01:03:27,678","Unless you're lost in the woods and you see a path. Follow that, but...",0,0.0,,,,3804.18,3807.68
1133,"01:03:30,056","01:03:33,810",I think that signs do help us and I think that if we pay attention,0,0.0,,,,3810.06,3813.81
1134,"01:03:33,893","01:03:37,230","to those signs, they do guide us. And some signs are easier...",0,0.0,,,,3813.89,3817.23
1135,"01:03:37,313","01:03:40,942",to spot than others. And I had something that was pretty significant,0,0.0,,,,3817.31,3820.94
1136,"01:03:41,025","01:03:42,902",that happened to me and...,0,0.0,,,,3821.03,3822.9
1137,"01:03:43,653","01:03:47,073",I didn't even know I was struggling with coming out.,0,0.0,,,,3823.65,3827.07
1138,"01:03:47,156","01:03:50,409","I mean, whenever you're closeted, you're always thinking about it.",0,0.0,,,,3827.16,3830.41
1139,"01:03:50,618","01:03:53,454",It's on your mind 'cause you're worried that someone's gonna find out.,0,0.0,,,,3830.62,3833.45
1140,"01:03:53,538","01:03:55,748",You're worried that someone's gonna know,0,0.0,,,,3833.54,3835.75
1141,"01:03:55,832","01:04:00,044","and so, it is on your mind, so subconsciously we're aware of that.",0,0.0,,,,3835.83,3840.04
1142,"01:04:00,127","01:04:02,922",But I didn't realize that until I had this dream.,0,0.0,,,,3840.13,3842.92
1143,"01:04:03,506","01:04:07,760","I had a dream that I was holding a baby finch, like a little precious bird",0,0.0,,,,3843.51,3847.76
1144,"01:04:07,844","01:04:12,598",and it was my pet and I put it back in its cage which was this beautiful,0,0.0,,,,3847.84,3852.6
1145,"01:04:12,682","01:04:15,309",multi-tiered bamboo cage,0,0.0,,,,3852.68,3855.31
1146,"01:04:15,726","01:04:19,522","and the bird became me, when it went into the cage and...",0,0.0,,,,3855.73,3859.52
1147,"01:04:20,022","01:04:22,859",all of a sudden it realized that it was up against the window,0,0.0,,,,3860.02,3862.86
1148,"01:04:22,942","01:04:26,445","all alone, and the window was open and the bars were wide enough",0,0.0,,,,3862.94,3866.45
1149,"01:04:26,529","01:04:29,657",for the bird to fly out. And it had been the whole time.,0,0.0,,,,3866.53,3869.66
1150,"01:04:29,782","01:04:33,160","And I looked at the bird and I said: ""Don't leave, you're safe in here.""",0,0.0,,,,3869.78,3873.16
1151,"01:04:33,244","01:04:35,955","And the bird looked at me and said: ""I don't belong in here.""",0,0.0,,,,3873.24,3875.95
1152,"01:04:36,038","01:04:37,039",And flew out.,0,0.0,,,,3876.04,3877.04
1153,"01:04:37,164","01:04:39,292","And the next morning, I woke up and I said:",0,0.0,,,,3877.16,3879.29
1154,"01:04:39,625","01:04:40,501","""I'm coming out.""",1,20.65000000000009,"#295, ","3880.79, ","3901.44, ",3879.62,3880.5
1155,"01:04:41,043","01:04:45,089",[crowd cheers],0,0.0,,,,3881.04,3885.09
1156,"01:04:46,966","01:04:49,802",[claps],0,0.0,,,,3886.97,3889.8
1157,"01:04:59,937","01:05:00,771",And...,0,0.0,,,,3899.94,3900.77
1158,"01:05:01,230","01:05:02,857",before I had that dream,0,0.0,,,,3901.23,3902.86
1159,"01:05:02,940","01:05:06,736",I didn't realize I was in a cage. I had no idea I was in a cage.,0,0.0,,,,3902.94,3906.74
1160,"01:05:06,819","01:05:07,904",I had a great life.,0,0.0,,,,3906.82,3907.9
1161,"01:05:08,029","01:05:09,447",I had a successful sitcom.,0,0.0,,,,3908.03,3909.45
1162,"01:05:09,530","01:05:12,950","I had fame, I had money, I had everything that I thought...",0,0.0,,,,3909.53,3912.95
1163,"01:05:13,326","01:05:16,412",that was important. But I was hiding a part of myself,0,0.0,,,,3913.33,3916.41
1164,"01:05:16,495","01:05:20,124","and whenever we hide anything from anybody, it's because...",0,0.0,,,,3916.49,3920.12
1165,"01:05:20,207","01:05:22,960",we're worried about what someone else is gonna think of us.,0,0.0,,,,3920.21,3922.96
1166,"01:05:23,085","01:05:24,795","And, even though...",0,0.0,,,,3923.09,3924.8
1167,"01:05:25,379","01:05:26,923",I knew that was gonna be difficult.,0,0.0,,,,3925.38,3926.92
1168,"01:05:27,006","01:05:29,425",I had gotten to the point where it was more important for me,0,0.0,,,,3927.01,3929.43
1169,"01:05:29,508","01:05:32,094",to feel proud of who I was and live my truth,0,0.0,,,,3929.51,3932.09
1170,"01:05:32,178","01:05:34,639",than worry about what other people thought of me.,1,11.019999999999982,"#296, ","3933.86, ","3944.88, ",3932.18,3934.64
1171,"01:05:34,722","01:05:35,973",[crowd claps],0,0.0,,,,3934.72,3935.97
1172,"01:05:36,140","01:05:36,974",And...,0,0.0,,,,3936.14,3936.97
1173,"01:05:38,559","01:05:40,561",[claps],0,0.0,,,,3938.56,3940.56
1174,"01:05:44,732","01:05:46,817","And that time, after I came out, was...",0,0.0,,,,3944.73,3946.82
1175,"01:05:46,901","01:05:49,654","really one of the hardest periods of my life, it was.",0,0.0,,,,3946.9,3949.65
1176,"01:05:49,946","01:05:51,948",But it was the best part of my journey.,0,0.0,,,,3949.95,3951.95
1177,"01:05:52,073","01:05:55,701",Because it is when I realized how strong I was.,0,0.0,,,,3952.07,3955.7
1178,"01:05:55,826","01:05:57,536",It's when I learned compassion.,0,0.0,,,,3955.83,3957.54
1179,"01:05:57,620","01:06:00,373",It's when I learned that the truth will always win.,0,0.0,,,,3957.62,3960.37
1180,"01:06:00,790","01:06:01,624",And...,0,0.0,,,,3960.79,3961.62
